{
  "name": "stop-agent-observer",
  "description": "Trigger agent observer on Stop event — incremental transcript analysis",
  "enabled": true,
  "event": "Stop",
  "priority": 90,
  "action": "context",
  "reason": "Agent observer: analyze transcript changes since last stop.",
  "feature": { "name": "agent", "config": { "mode": "trigger" } },
  "repeat": true
}
